<?xml version="1.0" encoding="UTF-8" ?>
<!ELEMENT stus (stu)>
<!ELEMENT stu (name,age,school)>
<!ATTLIST stu id ID #REQUIRED>
<!ELEMENT name (#PCDATA)>
<!ELEMENT age (#PCDATA)>
<!ELEMENT school (school_name)>
<!ATTLIST school id ID #REQUIRED>
<!ELEMENT school_name (#PCDATA)>
